{
  "schema_version": "1.0",
  "id": "mini-sqli",
  "challenge_name": "mini-sqli",
  "report_path": "examples/mini-sqli/nicetrygpt-report.json",
  "runtime": {
    "kind": "python_http",
    "before_entrypoint": "examples/mini-sqli/before/server.py",
    "after_entrypoint": "examples/mini-sqli/after/server.py",
    "ready_path": "/"
  },
  "verification": {
    "test_module": "tests/test_demo.py",
    "before_test": "test_sqli_before",
    "after_test": "test_sqli_after"
  }
}
